model_comparison.csv

Model,Accuracy,AUC,Precision,Recall,F1 Score,MCC
Logistic Regression,0.8981301602719767,0.800503890988619,0.6468646864686468,0.21120689655172414,0.31844029244516653,0.330172051124519
Decision Tree,0.8417921321029626,0.6312413150208558,0.3170731707317073,0.35021551724137934,0.33282130056323606,0.24371486870863884
KNN,0.8950947061680428,0.7403097603240661,0.5653061224489796,0.2984913793103448,0.3906911142454161,0.36003587140477256
Naive Bayes,0.8229723166585721,0.7760769816497745,0.3356079404466501,0.5829741379310345,0.4259842519685039,0.34780644373586006
SVM,0.8993443419135503,0.7971204354462753,0.68,0.20150862068965517,0.3108894430590191,0.33346996858673295

README.md

### 4.2 Observations on Each Model

Logistic Regression achieved an accuracy of 89.81% and the highest AUC score of 0.8005. Its precision is reasonably good, but recall is low at 0.2112. This means that although its predictions are often correct when it identifies a subscriber, it misses a considerable number of actual subscribers.

The Decision Tree achieved an accuracy of 84.18%. Its AUC score was 0.6312, which was the lowest among the five models. It achieved a recall of 0.3502, but its overall performance was lower than the other models in this experiment.

KNN achieved an accuracy of 89.51% and an F1 score of 0.3907. It also obtained the highest MCC score of 0.3600. Compared with Logistic Regression and SVM, KNN provided a better balance between precision and recall.

Gaussian Naive Bayes achieved an accuracy of 82.30%. It recorded the highest recall of 0.5830 and the highest F1 score of 0.4260. Its precision was lower than the other models, but it was able to identify more actual subscribers. This makes it useful when finding potential subscribers is the main objective.

The Linear Support Vector Machine achieved the highest accuracy of 89.93% and the highest precision of 0.6800. Its AUC score was 0.7971. However, its recall was only 0.2015, which means it missed many actual subscribers.

## 4.3 Overall Winner

It achieved the highest F1 score of 0.4260 and the highest recall of 0.5830. Since the objective is to identify customers who are likely to subscribe to a term deposit, identifying more actual subscribers is important.